{
  "$schema": "https://json-schema.org/draft/2020-12/schema",
  "title": "Post-Copy Automation Config",
  "description": "Array of declarative post-copy actions consumed by the Salesforce post-copy automation tool.",
  "type": "array",
  "items": {
    "type": "object",
    "additionalProperties": false,
    "required": [
      "ConfigurationName",
      "Label",
      "Fields",
      "IsActive",
      "ExecutionOrder"
    ],
    "allOf": [
      {
        "if": {
          "properties": { "ConfigurationName": { "const": "RemoteSiteSettings" } }
        },
        "then": {
          "properties": {
            "Fields": {
              "type": "object",
              "additionalProperties": false,
              "required": ["RemoteSiteUrl"],
              "properties": {
                "RemoteSiteUrl": {
                  "description": "The exact API field name for a Remote Site Setting URL. Must be spelled RemoteSiteUrl — Url, RemoteSiteURL, SiteUrl, and EndpointUrl are all invalid.",
                  "type": "string",
                  "minLength": 1
                }
              }
            }
          }
        }
      },
      {
        "if": {
          "properties": { "ConfigurationName": { "const": "OutboundMessages" } }
        },
        "then": {
          "properties": {
            "Fields": {
              "type": "object",
              "required": ["Object"],
              "anyOf": [
                { "type": "object", "required": ["EndpointUrl"] },
                { "type": "object", "required": ["Action"] }
              ]
            }
          }
        }
      },
      {
        "if": {
          "properties": { "ConfigurationName": { "const": "ScheduledApex" } }
        },
        "then": {
          "properties": {
            "Fields": {
              "type": "object",
              "additionalProperties": false,
              "required": ["ApexClassName", "CronExpression", "JobName"],
              "properties": {
                "ApexClassName": {
                  "description": "Bare Apex identifier of the class that implements Schedulable. Must match ^[A-Za-z_][A-Za-z0-9_]*$.",
                  "type": "string",
                  "pattern": "^[A-Za-z_][A-Za-z0-9_]*$"
                },
                "CronExpression": {
                  "description": "Salesforce cron expression — 6 or 7 whitespace-separated fields.",
                  "type": "string",
                  "minLength": 1
                },
                "JobName": {
                  "description": "Human-readable job name. Appears in Setup > Scheduled Jobs and equals CronTrigger.CronJobDetail.Name post-schedule.",
                  "type": "string",
                  "minLength": 1
                }
              }
            }
          }
        }
      },
      {
        "if": {
          "properties": { "ConfigurationName": { "const": "Flows" } }
        },
        "then": {
          "properties": {
            "Fields": {
              "type": "object",
              "additionalProperties": false,
              "required": ["FlowApiName", "Action"],
              "properties": {
                "FlowApiName": {
                  "description": "Flow DeveloperName — unique across Flows in the org. Maps to FlowDefinition.DeveloperName. Must match ^[A-Za-z_][A-Za-z0-9_]*$.",
                  "type": "string",
                  "pattern": "^[A-Za-z_][A-Za-z0-9_]*$"
                },
                "Action": {
                  "description": "Whether the apply-side skill should Activate or Deactivate the flow. Exact string match, case-sensitive.",
                  "type": "string",
                  "enum": ["Activate", "Deactivate"]
                },
                "VersionNumber": {
                  "description": "Optional. Only meaningful when Action is Activate — the specific flow version to activate. If omitted for Activate, the apply-side skill resolves to the latest saved version. Ignored for Deactivate.",
                  "type": "integer",
                  "minimum": 1
                }
              }
            }
          }
        }
      }
    ],
    "properties": {
      "ConfigurationName": {
        "description": "Salesforce configuration / metadata type. Must be one of the values listed in references/configuration_catalog.md.",
        "type": "string",
        "enum": [
          "OutboundMessages",
          "RemoteSiteSettings",
          "ScheduledApex",
          "Flows"
        ]
      },
      "Label": {
        "description": "The metadata Label or DeveloperName of the specific record being updated, exactly as it appears in the SOP.",
        "type": "string",
        "minLength": 1
      },
      "Fields": {
        "description": "Map of API field name -> concrete value taken verbatim from the SOP. Do not include fields that are duplicated by Label (RemoteSiteName) or by the top-level IsActive flag.",
        "type": "object",
        "minProperties": 1,
        "additionalProperties": {
          "type": ["string", "number", "boolean"]
        },
        "$comment": "Per-ConfigurationName key constraints are enforced by the allOf/if-then blocks above."
      },
      "IsActive": {
        "description": "Whether the post-copy tool should execute this action. Default true.",
        "type": "boolean"
      },
      "ExecutionOrder": {
        "description": "Phase number. Entries with no dependency on each other share the same value and run in parallel; lower numbers run before higher.",
        "type": "integer",
        "minimum": 1
      }
    }
  }
}
